{
  "name": "atmux",
  "version": "0.1.0",
  "description": "Atmux skills — cockpit-tier workflows for atmux team-of-teams (11 skills: team lifecycle, session continuity, fleet sweeps, driver consolidation, etc.) — per ADR-217 §D8; bruh/bruhloop retired per ADR-290 §D4.",
  "atmuxCompat": ">=0.8.10",
  "skills": [
    { "name": "team", "path": "skills/team/SKILL.md" },
    { "name": "driver", "path": "skills/driver/SKILL.md" },
    { "name": "session", "path": "skills/session/SKILL.md" },
    { "name": "tell-lead", "path": "skills/tell-lead/SKILL.md" },
    { "name": "heads-up", "path": "skills/heads-up/SKILL.md" },
    { "name": "whip", "path": "skills/whip/SKILL.md" },
    { "name": "bau", "path": "skills/bau/SKILL.md" },
    { "name": "ghostbuster", "path": "skills/ghostbuster/SKILL.md" },
    { "name": "budget", "path": "skills/budget/SKILL.md" },
    { "name": "sweep", "path": "skills/sweep/SKILL.md" },
    { "name": "cockpit-rebuild", "path": "skills/cockpit-rebuild/SKILL.md" }
  ]
}
